title,article_id,ai4epi_abstract_decision,downloaded
A systematic review and meta-analysis of the aetiological agents of non-malarial febrile illnesses in Africa,PMID_35073309,EXCLUDE,True
Recent advances in marburgvirus research,PMID_31131088,EXCLUDE,True
"Links Between Ecological Integrity, Emerging Infectious Diseases Originating from Wildlife, and Other Aspects of Human Health - An Overview of the Literature",DOI_40062615b9d1,EXCLUDE,True
HERC5 and the ISGylation Pathway: Critical Modulators of the Antiviral Immune Response,PMID_34207696,EXCLUDE,True
AIDS: an old disease from Africa?,PMID_6331565,EXCLUDE,True
Bibliometric Analysis and Systematic Review of Global Coronavirus Research Trends Before COVID-19: Prospects and Implications for COVID-19 Research,PMID_34869424,EXCLUDE,True
TIM-1 Promotes Japanese Encephalitis Virus Entry and Infection,PMID_30441759,EXCLUDE,True
The Spectrum of Manifestations of Severe Acute Respiratory Syndrome-Coronavirus 2 (SARS-CoV2) Infection in Children: What We Can Learn From Multisystem Inflammatory Syndrome in Children (MIS-C),PMID_34778310,EXCLUDE,True
"Mortality of employees of the Atomic Weapons Establishment, 1951-82.",PMID_3142540,EXCLUDE,True
Vaccine-Associated Enhanced Disease and Pathogenic Human Coronaviruses,PMID_35444667,EXCLUDE,True
The microbiota-related coinfections in COVID-19 patients: a real challenge,PMID_34458380,EXCLUDE,True
Feasibility of virtual reality based training for optimising COVID-19 case handling in Uganda,PMID_35418070,EXCLUDE,True
A comparison of host gene expression signatures associated with infection in vitro by the Makona and Ecran (Mayinga) variants of Ebola virus,DOI_04b07e53b238,EXCLUDE,True
"Prevalence and Risk Factors of Anxiety, Depression, and Sleep Problems Among Caregivers of People Living With Neurocognitive Disorders During the COVID-19 Pandemic",PMID_33488423,EXCLUDE,True
Vesicular stomatitis virus enables gene transfer and transsynaptic tracing in a wide range of organisms,PMID_25688551,EXCLUDE,True
Intramuscular Adeno-Associated Virus–Mediated Expression of Monoclonal Antibodies Provides 100% Protection Against Ebola Virus Infection in Mice,PMID_29365142,EXCLUDE,True
"Hsa-miR-1246, hsa-miR-320a and hsa-miR-196b-5p inhibitors can reduce the cytotoxicity of Ebola virus glycoprotein in vitro",PMID_25218824,EXCLUDE,True
Characterization and analytical validation of a new antigenic rapid diagnostic test for Ebola virus disease detection,PMID_31951615,EXCLUDE,True
Principles of Virus Uncoating: Cues and the Snooker Ball,PMID_26875443,EXCLUDE,True
Risk factors for herpes simplex virus type-1 infection and reactivation: Cross-sectional studies among EPIC-Norfolk participants,PMID_31071098,EXCLUDE,True
Structure of the Ebola virus glycoprotein spike within the virion envelope at 11 Å resolution,PMID_28397863,EXCLUDE,True
A Universal Model for Predicting Dynamics of the Epidemics Caused by Special Pathogens,PMID_23998125,EXCLUDE,True
Association of household fuel with acute respiratory infection (ARI) under-five years children in Bangladesh,PMID_36530721,EXCLUDE,True
Innovative Therapeutic Strategies for Cystic Fibrosis: Moving Forward to CRISPR Technique,PMID_29731717,EXCLUDE,True
The Ebola outbreak in West Africa: a story of related public health challenges and a pointer to solutions to mitigate the inevitable next outbreak,PMID_25667710,EXCLUDE,True
"First Human Rabies Case in French Guiana, 2008: Epidemiological Investigation and Control",PMID_22363830,EXCLUDE,True
Acute disseminated encephalomyelitis,PMID_12566545,EXCLUDE,True
Comparison of fit factors among healthcare providers working in the Emergency Department Center before and after training with three types of N95 and higher filter respirators,PMID_30732139,EXCLUDE,True
Virus survey in populations of two subspecies of bent-winged bats (Miniopterus orianae bassanii and oceanensis) in south-eastern Australia reveals a high prevalence of diverse herpesviruses,PMID_29795610,EXCLUDE,True
"Genes, inflammatory response, tolerance, and resistance to virus infections in migratory birds, bats, and rodents",PMID_37711609,EXCLUDE,True
"Ebola management centre proximity associated with reduced delays of healthcare of Ebola Virus Disease (EVD) patients, Tonkolili, Sierra Leone, 2014–15",PMID_28459838,EXCLUDE,True
Ebola Virus Disease has Features of Hemophagocytic Lymphohistiocytosis Syndrome,PMID_25699258,EXCLUDE,True
Pulmonary Involvement during the Ebola Virus Disease,PMID_31450596,EXCLUDE,True
"A narrative review on the basic and clinical aspects of the novel SARS-CoV-2, the etiologic agent of COVID-19",PMID_33490198,EXCLUDE,True
Infection with the Makona variant results in a delayed and distinct host immune response compared to previous Ebola virus variants,PMID_28852031,EXCLUDE,True
Ebolaviruses: New roles for old proteins,PMID_29723187,EXCLUDE,True
The Lymphocytic Choriomeningitis Virus Matrix Protein PPXY Late Domain Drives the Production of Defective Interfering Particles,PMID_27010636,EXCLUDE,True
"Immunological correlates of protection afforded by PHV02 live, attenuated recombinant vesicular stomatitis virus vector vaccine against Nipah virus disease",PMID_37731485,EXCLUDE,True
Lipids in Pathophysiology and Development of the Membrane Lipid Therapy: New Bioactive Lipids,PMID_34940418,EXCLUDE,True
A bird's eye view on the role of dendritic cells in SARS‐CoV‐2 infection: Perspectives for immune‐based vaccines,PMID_34245591,EXCLUDE,True
Heterogeneity of Leishmania donovani Parasites Complicates Diagnosis of Visceral Leishmaniasis: Comparison of Different Serological Tests in Three Endemic Regions,PMID_25734336,EXCLUDE,True
"The intersection of land use and human behavior as risk factors for zoonotic pathogen exposure in Laikipia County, Kenya",PMID_33606671,EXCLUDE,True
A Primer on Ebola for Clinicians,PMID_25325294,EXCLUDE,True
Detecting Remote Sequence Homology in Disordered Proteins: Discovery of Conserved Motifs in the N-Termini of Mononegavirales phosphoproteins,PMID_22403617,EXCLUDE,True
The Impact of Pathogens on Sepsis Prevalence and Outcome,PMID_38276162,EXCLUDE,True
Potential distributions of Bacillus anthracis and Bacillus cereus biovar anthracis causing anthrax in Africa,PMID_32150557,EXCLUDE,True
COVID-19 Infection in the Human Reproductive Tract of Men and Nonpregnant Women,PMID_33534765,EXCLUDE,True
Steric Shielding of Surface Epitopes and Impaired Immune Recognition Induced by the Ebola Virus Glycoprotein,PMID_20844579,EXCLUDE,True
Broad-spectrum antiviral agents,PMID_26052325,EXCLUDE,True
The nosology of the spinal muscular atrophies.,DOI_14a1341879ff,EXCLUDE,True
Single Cell Metabolomics: A Future Tool to Unmask Cellular Heterogeneity and Virus-Host Interaction in Context of Emerging Viral Diseases,PMID_32582094,EXCLUDE,True
Immunogenicity of various variants of Ebola and Marburg virus glycoprotein genes in recombinant adenoviral vectors,DOI_569d5c84455c,EXCLUDE,True
DAMP Molecule S100A9 Acts as a Molecular Pattern to Enhance Inflammation during Influenza A Virus Infection: Role of DDX21-TRIF-TLR4-MyD88 Pathway,PMID_24391503,EXCLUDE,True
Evidence for distinct mechanisms of small molecule inhibitors of filovirus entry,PMID_33539432,EXCLUDE,True
Dynamical analysis and control strategies in modelling Ebola virus disease,DOI_5a5fc4668e63,EXCLUDE,True
A Perspective on the Development of Plant-Made Vaccines in the Fight against Ebola Virus,PMID_28344580,EXCLUDE,True
Susceptibility of Marmosets (Callithrix jacchus) to Monkeypox Virus: A Low Dose Prospective Model for Monkeypox and Smallpox Disease,PMID_26147658,EXCLUDE,True
Asymptomatic SARS-CoV-2 infection: is it all about being refractile to innate immune sensing of viral spare-parts?—Clues from exotic animal reservoirs,PMID_33289808,EXCLUDE,True
The phosphatidylinositol-3-phosphate 5-kinase inhibitor apilimod blocks filoviral entry and infection,PMID_28403145,EXCLUDE,True
Sustained protection against Ebola virus infection following treatment of infected nonhuman primates with ZMAb,DOI_8b7cfa23169a,EXCLUDE,True
A Virus-Like Particle System Identifies the Endonuclease Domain of Crimean-Congo Hemorrhagic Fever Virus,DOI_b2628c57c54e,EXCLUDE,True
Vaccines against Botulism,PMID_28869493,EXCLUDE,True
Nucleocapsid proteins: roles beyond viral <scp>RNA</scp> packaging,PMID_26749541,EXCLUDE,True
Clinical Diagnosis of Herpes Zoster in Family Practice,PMID_17664496,EXCLUDE,True
Hemopexin and haptoglobin: allies against heme toxicity from hemoglobin not contenders,PMID_26175690,EXCLUDE,True
Structural basis for broad neutralization of ebolaviruses by an antibody targeting the glycoprotein fusion loop,PMID_30258051,EXCLUDE,True
Depletion and Dysfunction of Dendritic Cells: Understanding SARS-CoV-2 Infection,PMID_35265087,EXCLUDE,True
"Novel Antiviral Activities of Obatoclax, Emetine, Niclosamide, Brequinar, and Homoharringtonine",PMID_31635418,EXCLUDE,True
"The Conflict Between Pteropodid Bats and Fruit Growers: Species, Legislation and Mitigation",DOI_0578c6c0cba4,EXCLUDE,True
Evolutionary maintenance of filovirus-like genes in bat genomes,PMID_22093762,EXCLUDE,True
Prospective study of diarrhoeal disease in a cohort of rural Mexican children: incidence and isolated pathogens during the first two years of life,PMID_3402544,EXCLUDE,True
Sepsis – it is all about the platelets,PMID_37350961,EXCLUDE,True
Transcriptional regulation of the human cystathionine β-synthase −1b basal promoter: synergistic transactivation by transcription factors NF-Y and Sp1/Sp3,PMID_11415440,EXCLUDE,True
Screening and Surveillance for Promoting Population Health,DOI_f7699878ea1f,EXCLUDE,True
HIV RNA Suppression Among HIV-Infected Ugandan Children With Measles,PMID_18520684,EXCLUDE,True
Tacaribe Virus but Not Junin Virus Infection Induces Cytokine Release from Primary Human Monocytes and Macrophages,PMID_21572983,EXCLUDE,True
Serological screening for sexually transmitted infections in pregnancy: is there any value in re-screening for HIV and syphilis at the time of delivery?,PMID_7744414,EXCLUDE,True
Diatoms Biotechnology: Various Industrial Applications for a Greener Tomorrow,DOI_33c51e727e5d,EXCLUDE,True
Peripheral immune responses to filoviruses in a reservoir versus spillover hosts reveal transcriptional correlates of disease,PMID_38259437,EXCLUDE,True
Transcriptome Analysis of Circulating Immune Cell Subsets Highlight the Role of Monocytes in Zaire Ebola Virus Makona Pathogenesis,PMID_29123522,EXCLUDE,True
"Ebola Holding Units at government hospitals in Sierra Leone: evidence for a flexible and effective model for safe isolation, early treatment initiation, hospital safety and health system functioning",PMID_28588922,EXCLUDE,True
Dengue Virus Co-opts UBR4 to Degrade STAT2 and Antagonize Type I Interferon Signaling,PMID_23555265,EXCLUDE,True
Repurposing FDA-approved drugs as therapeutics to treat Rift Valley fever virus infection,PMID_26217313,EXCLUDE,True
Emerging Viral Diseases,DOI_e431ecd53c3d,EXCLUDE,True
Comprehensive analysis of the codon usage patterns in the envelope glycoprotein E2 gene of the classical swine fever virus,PMID_28880881,EXCLUDE,True
Beyond Lassa Fever: Systemic and structural barriers to disease detection and response in Sierra Leone,PMID_35587495,EXCLUDE,True
Comprehensive Multiplex One-Step Real-Time TaqMan qRT-PCR Assays for Detection and Quantification of Hemorrhagic Fever Viruses,PMID_24752452,EXCLUDE,True
Field Evaluation of Capillary Blood Samples as a Collection Specimen for the Rapid Diagnosis of Ebola Virus Infection During an Outbreak Emergency,PMID_25991465,EXCLUDE,True
"Reemergence of<i>Reston</i><i>ebolavirus</i>in Cynomolgus Monkeys, the Philippines, 2015",PMID_29912712,EXCLUDE,True
An Overview of Ebola Viral Disease,DOI_37f27c7d9403,EXCLUDE,True
Amaryllidaceae alkaloids inhibit nuclear‐to‐cytoplasmic export of ribonucleoprotein (RNP) complex of highly pathogenic avian influenza virus H5N1,PMID_23136954,EXCLUDE,True
Immune response and possible therapeutics in COVID-19,PMID_35423713,EXCLUDE,True
Infection Transmission Science and Models,PMID_16377860,EXCLUDE,True
"Mediterranean Diet, Telomere Maintenance and Health Status among Elderly",PMID_23646142,EXCLUDE,True
A Quarter Century of Emerging Infectious Diseases – Where Have We Been and Where Are We Going?,PMID_29957979,EXCLUDE,True
Importance of Viral Late Domains in Budding and Release of Enveloped RNA Viruses,PMID_34452424,EXCLUDE,True
"Sexual behaviour among youths at high risk for HIV-1 infection in Dar es Salaam, Tanzania",PMID_11463924,EXCLUDE,True
"Developments in Transduction, Connectivity and AI/Machine Learning for Point-of-Care Testing",PMID_31018573,EXCLUDE,True
Developing Recombinant Antibodies by Phage Display Against Infectious Diseases and Toxins for Diagnostics and Therapy,PMID_34307196,EXCLUDE,True
Severe Hemorrhagic Fever in Strain 13/N Guinea Pigs Infected with Lujo Virus,PMID_22953019,EXCLUDE,True
Field Validation of the ReEBOV Antigen Rapid Test for Point-of-Care Diagnosis of Ebola Virus Infection,PMID_27521365,EXCLUDE,True
"The design and implementation of the re-vitalised integrated disease surveillance and response (IDSR) in Uganda, 2013–2016",PMID_30005613,EXCLUDE,True
RNAi-based small molecule repositioning reveals clinically approved urea-based kinase inhibitors as broadly active antivirals,PMID_30883607,EXCLUDE,True
"A Synthetic Serine Protease Inhibitor, Nafamostat Mesilate, Is a Drug Potentially Applicable to the Treatment of Ebola Virus Disease",PMID_26346967,EXCLUDE,True
Microbial Metabolites: The Emerging Hotspot of Antiviral Compounds as Potential Candidates to Avert Viral Pandemic Alike COVID-19,PMID_34557521,EXCLUDE,True
Repurposing Approved Drugs for Guiding COVID-19 Prophylaxis: A Systematic Review,PMID_33390967,EXCLUDE,True
Cardio-Immunology of Myocarditis: Focus on Immune Mechanisms and Treatment Options,PMID_31032264,EXCLUDE,True
COVID-19 Contact Tracing Strategies During the First Wave of the Pandemic: Systematic Review of Published Studies,PMID_37351939,EXCLUDE,True
Biotechnological applications of recombinant single-domain antibody fragments,PMID_21658216,EXCLUDE,True
Small molecules targeting viral <scp>RNA</scp>,PMID_27307213,EXCLUDE,True
A Genome-Wide Association Study Identifies rs2000999 as a Strong Genetic Determinant of Circulating Haptoglobin Levels,PMID_22403646,EXCLUDE,True
Mutations at positions 186 and 194 in the HA gene of the 2009 H1N1 pandemic influenza virus improve replication in cell culture and eggs,PMID_20630098,EXCLUDE,True
Short Report: Serological Evidence of Under-Reported Dengue Circulation in Sierra Leone,PMID_27116605,EXCLUDE,True
Molecular Epidemiology of Paramyxoviruses in Frugivorous &lt;i&gt;Eidolon helvum&lt;/i&gt; Bats in Zambia,PMID_24389743,EXCLUDE,True
"Evaluation of Early Warning, Alert and Response System for Ebola Virus Disease, Democratic Republic of the Congo, 2018–2020",PMID_34808084,EXCLUDE,True
Comparative Genomics of Bacillus amyloliquefaciens Strains Reveals a Core Genome with Traits for Habitat Adaptation and a Secondary Metabolites Rich Accessory Genome,PMID_28824571,EXCLUDE,True
Community health workers for pandemic response: a rapid evidence synthesis,DOI_02b02b2da106,EXCLUDE,True
Horizontal Gene Transfer in Archaea—From Mechanisms to Genome Evolution,PMID_35667126,EXCLUDE,True
SURFACE MARKERS ON HUMAN B AND T LYMPHOCYTES,PMID_4357682,EXCLUDE,True
Sequencing of DC-SIGN promoter indicates an association between promoter variation and risk of nasopharyngeal carcinoma in cantonese,PMID_21067616,EXCLUDE,True
"Should Remdesivir Be Used for the Treatment of Patients With COVID-19? Rapid, Living Practice Points From the American College of Physicians (Version 1)",PMID_33017175,EXCLUDE,True
Quantification of Ebola virus replication kinetics in vitro,PMID_33137116,EXCLUDE,True
Seeking Clearer Recommendations for Hand Hygiene in Communities Facing Ebola: A Randomized Trial Investigating the Impact of Six Handwashing Methods on Skin Irritation and Dermatitis,PMID_28030544,EXCLUDE,True
Enzyme-linked immunosorbent assays for the detection of antibody to Crimean-Congo haemorrhagic fever virus in the sera of livestock and wild vertebrates,PMID_8270014,EXCLUDE,True
"Drug use and health behaviour among German men who have sex with men: Results of a qualitative, multi-centre study",PMID_27938393,EXCLUDE,True
Selection of a Biosafety Level 1 (BSL-1) surrogate to evaluate surface disinfection efficacy in Ebola outbreaks: Comparison of four bacteriophages,PMID_28531182,EXCLUDE,True
"ROS/RNS Balancing, Aerobic Fermentation Regulation and Cell Cycle Control – a Complex Early Trait (‘CoV-MAC-TED’) for Combating SARS-CoV-2-Induced Cell Reprogramming",PMID_34305903,EXCLUDE,True
"Ebola Virus Glycoprotein Needs an Additional Trigger, beyond Proteolytic Priming for Membrane Fusion",PMID_22102923,EXCLUDE,True
Coronavirus Pseudotypes for All Circulating Human Coronaviruses for Quantification of Cross-Neutralizing Antibody Responses,PMID_34452443,EXCLUDE,True
A Porcine Adenovirus with Low Human Seroprevalence Is a Promising Alternative Vaccine Vector to Human Adenovirus 5 in an H5N1 Virus Disease Model,PMID_21179494,EXCLUDE,True
Novel Methods in Disease Biogeography: A Case Study with Heterosporosis,PMID_28770215,EXCLUDE,True
Influenza virus pathogenicity is determined by caspase cleavage motifs located in the viral proteins,PMID_19565021,EXCLUDE,True
The integrated disease surveillance and response system in northern Ghana: challenges to the core and support functions,PMID_26216356,EXCLUDE,True
Multiple Novel Functions of Henipavirus O-glycans: The First O-glycan Functions Identified in the Paramyxovirus Family,PMID_26867212,EXCLUDE,True
Concomitant Tickborne Encephalitis and Human Granulocytic Ehrlichiosis,PMID_15757574,EXCLUDE,True
Targeting the C-type Lectins-Mediated Host-Pathogen Interactions with Dextran,PMID_25224349,EXCLUDE,True
Global COVID-19 vaccine acceptance level and its determinants: an umbrella review,PMID_38166750,EXCLUDE,True
The stability analysis and control transmission of mathematical model for Ebola Virus,DOI_2c406912f193,EXCLUDE,True
Diversity of Bartonella and Rickettsia spp. in Bats and Their Blood-Feeding Ectoparasites from South Africa and Swaziland,PMID_26999518,EXCLUDE,True
Enhancement of the Influenza A Hemagglutinin (HA)-Mediated Cell-Cell Fusion and Virus Entry by the Viral Neuraminidase (NA),PMID_20041119,EXCLUDE,True
Elimination of Falciparum Malaria and Emergence of Severe Dengue: An Independent or Interdependent Phenomenon?,PMID_29899735,EXCLUDE,True
Crimean-Congo hemorrhagic fever: a growing threat to Europe,PMID_35787618,EXCLUDE,True
Sliding Fractal Dimensions of Subviral Particles in Fluorescence Image Sequences,DOI_344d45165a19,EXCLUDE,True
"The Antiviral Restriction Factors IFITM1, 2 and 3 Do Not Inhibit Infection of Human Papillomavirus, Cytomegalovirus and Adenovirus",PMID_24827144,EXCLUDE,True
Translational upregulation of folate receptors is mediated by homocysteine via RNA-heterogeneous nuclear ribonucleoprotein E1 interactions,PMID_14722620,EXCLUDE,True
"Rubella Epidemics and Genotypic Distribution of the Rubella Virus in Shandong Province, China, in 1999–2010",PMID_22911874,EXCLUDE,True
Use of a rapid digital microfluidics-powered immunoassay for assessing measles and rubella infection and immunity in outbreak settings in the Democratic Republic of the Congo,PMID_36542608,EXCLUDE,True
Sensitivity and Specificity of Suspected Case Definition Used during West Africa Ebola Epidemic,PMID_29260687,EXCLUDE,True
Infectious Diseases of the Nervous System,DOI_9064b93b3ab5,EXCLUDE,True
Analysis of Cathepsin and Furin Proteolytic Enzymes Involved in Viral Fusion Protein Activation in Cells of the Bat Reservoir Host,PMID_25706132,EXCLUDE,True
"Bat Influenza A(HL18NL11) Virus in Fruit Bats, Brazil",PMID_30666923,EXCLUDE,True
"Strategy, Progress, and Challenges of Drug Repurposing for Efficient Antiviral Discovery",PMID_34017257,EXCLUDE,True
"Comprehensive analysis of two potential novel SARS-CoV-2 entries, TMPRSS2 and IFITM3, in healthy individuals and cancer patients",PMID_33061814,EXCLUDE,True
Real-Time PCR for Measles Virus Detection on Clinical Specimens with Negative IgM Result in Morocco,PMID_26812434,EXCLUDE,True
"Genomic Characterization of Rift Valley Fever Virus, South Africa, 2018",PMID_31538932,EXCLUDE,True
"The utility of measles and rubella IgM serology in an elimination setting, Ontario, Canada, 2009–2014",PMID_28850604,EXCLUDE,True
"Lassa fever outbreaks, mathematical models, and disease parameters: a systematic review and meta-analysis",DOI_6b280ab070f1,EXCLUDE,True
"Evidence of co-exposure with Brucella spp, Coxiella burnetii, and Rift Valley fever virus among various species of wildlife in Kenya",PMID_35939503,EXCLUDE,True
Societal feedback induces complex and chaotic dynamics in endemic infectious diseases,DOI_1e70cd594eb1,EXCLUDE,True
Serological evidence of zoonotic filovirus exposure among bushmeat hunters in Guinea,DOI_9a919220a6fa,EXCLUDE,True
Protein engineering strategies for rational immunogen design,PMID_34921149,EXCLUDE,True
Awareness and preparedness of healthcare workers against the first wave of the COVID-19 pandemic: A cross-sectional survey across 57 countries,PMID_34936646,EXCLUDE,True
Ethical and sociocultural challenges in managing dead bodies during epidemics and natural disasters,PMID_34740913,EXCLUDE,True
"Strategies for the Preservation, Restoration and Modulation of the Human Milk Microbiota. Implications for Human Milk Banks and Neonatal Intensive Care Units",PMID_30473683,EXCLUDE,True
A novel epitope on the C-terminus of SmD1 is recognized by the majority of sera from patients with systemic lupus erythematosus.,PMID_9710444,EXCLUDE,True
Role of Natural Killer Cells in Innate Protection against Lethal Ebola Virus Infection,PMID_15249592,EXCLUDE,True
Binding of DC-SIGN to the Hemagglutinin of Influenza A Viruses Supports Virus Replication in DC-SIGN Expressing Cells,PMID_23424649,EXCLUDE,True
Hydrogen sulfide in physiology and pathogenesis of bacteria and viruses,PMID_29601123,EXCLUDE,True
Self-Replicating RNA Viruses for RNA Therapeutics,PMID_30551668,EXCLUDE,True
The Search for a Practical Approach to Emerging Diseases: The Case of Severe Acute Respiratory Syndrome (SARS),PMID_12885151,EXCLUDE,True
Quantifying Rift Valley fever virus transmission efficiency in a lamb-mosquito-lamb model,PMID_38170150,EXCLUDE,True
Comprehensive Analysis of Codon Usage on Rabies Virus and Other Lyssaviruses,PMID_30110957,EXCLUDE,True
"Mandated Actions, Legitimate Role-Bearers and Expected Actor Networks in the Management of Infectious Disease Epidemics: The Case of Marburg Virus Disease in Uganda.",DOI_4b9458b3a43b,EXCLUDE,True
Testing therapeutics in cell-based assays: Factors that influence the apparent potency of drugs,PMID_29566079,EXCLUDE,True
"Exposure to Ebola Virus and Risk for Infection with Malaria Parasites, Rural Gabon",PMID_31829919,EXCLUDE,True
Artificial Light at Night (ALAN): A Potential Anthropogenic Component for the COVID-19 and HCoVs Outbreak,PMID_33013700,EXCLUDE,True
Progress of vaccine and drug development for Ebola preparedness,PMID_25648233,EXCLUDE,True
TCR stimulation strength is inversely associated with establishment of functional brain-resident memory CD8 T cells during persistent viral infection,PMID_28410427,EXCLUDE,True
"Rift Valley Fever Outbreak during COVID-19 Surge, Uganda, 2021",PMID_36150455,EXCLUDE,True
"Engaging religious leaders to promote safe burial practices during the 2014–2016 Ebola virus disease outbreak, Sierra Leone",PMID_33953444,EXCLUDE,True
A sustainable trend in COVID-19 research: An environmental perspective,DOI_6b75d20d4a01,EXCLUDE,True
"A Randomised, Double-Blind, Controlled Vaccine Efficacy Trial of DNA/MVA ME-TRAP Against Malaria Infection in Gambian Adults",PMID_15526058,EXCLUDE,True
Tick-borne Encephalitis in Southern Norway,PMID_15109431,EXCLUDE,True
"Bat flies (Diptera: Nycteribiidae and Streblidae) infesting cave-dwelling bats in Gabon: diversity, dynamics and potential role in Polychromophilus melanipherus transmission",PMID_27286888,EXCLUDE,True
First International External Quality Assessment of Molecular Detection of Crimean-Congo Hemorrhagic Fever Virus,PMID_22745842,EXCLUDE,True
Biovacc-19: A Candidate Vaccine for Covid-19 (SARS-CoV-2) Developed from Analysis of its General Method of Action for Infectivity,PMID_34192262,EXCLUDE,True
Low immunogenicity of seasonal trivalent influenza vaccine among patients receiving docetaxel for a solid tumour: results of a prospective pilot study,PMID_21540859,EXCLUDE,True
Adrenal infections,PMID_16483815,EXCLUDE,True
"Molecular Characterization of Circulating Yellow Fever Viruses from Outbreak in Ghana, 2021–2022",PMID_37610174,EXCLUDE,True
Comprehensive genome based analysis of Vibrio parahaemolyticus for identifying novel drug and vaccine molecules: Subtractive proteomics and vaccinomics approach,PMID_32813697,EXCLUDE,True
"Traditional Uses, Pharmacological Effects, and Molecular Mechanisms of Licorice in Potential Therapy of COVID-19",PMID_34899289,EXCLUDE,True
Serological evidence of Ebola virus exposure in dogs from affected communities in Liberia: A preliminary report,PMID_31329600,EXCLUDE,True
"SARS-CoV-2 Pandemic: Not the First, Not the Last",PMID_33669805,EXCLUDE,True
Family Medicine and Disease Prevention: Core Topics for Modern and Healthy Society,DOI_30485bd46c36,EXCLUDE,True
AeTIOLOGY AND PATHOGENESIS OF ACUTE SPORADIC DISSEMINATED ENCEPHALOMYELITIS AND MULTIPLE SCLEROSIS,PMID_20274397,EXCLUDE,True
"Mitigating Impacts of the COVID-19 Pandemic on Gorilla Conservation: Lessons From Bwindi Impenetrable Forest, Uganda",PMID_34490176,EXCLUDE,True
Chinese military medical teams in the Ebola outbreak of Sierra Leone,PMID_26744190,EXCLUDE,True
