title,article_id,ai4epi_abstract_decision,downloaded
Studies on Experimental Tuberculosis in Mice The Susceptibility of Mice to Inoculation with Tubercle Bacilli,PMID_20474893,EXCLUDE,True
De Mexican flu à A(H1N1)pdm09 : les efforts de normalisation de l’OMS pour la dénomination des nouvelles maladies infectieuses humaines,DOI_fdf040315e51,EXCLUDE,True
Nanofibers in Cosmetics,DOI_927e83256584,EXCLUDE,True
"The Investigation of the Effect of Antibody Recruiting Molecules on Various Antigenic Markers (Cancer, Bacteria, Viruses): A Literature Review",DOI_0316d4a6c235,EXCLUDE,True
Nuevos mecanismos de colaboración público-privada para el desarrollo y acceso a la vacuna COVID-19: una perspectiva desde la teoría fundamentada,DOI_2f27481bcf15,EXCLUDE,True
Pitfalls in Understanding and Handling of Covid-19 Vaccination (“Any Fool Can Know. The Point Is to Understand”),DOI_6ddfe9905862,EXCLUDE,True
Associations Between 25-Hydroxyvitamin D and Total and γ' Fibrinogen and Plasma Clot Properties and Gene Interactions in a Group of Healthy Black South African Women,PMID_35903674,EXCLUDE,True
Treatment of severe coagulation disturbances as a condition of improved prognosis in fulminant liver failure.,PMID_3977392,EXCLUDE,True
Virus specific antibody - based remedies for the urgent prevention and treatment of Ebola virus disease,PMID_32598619,EXCLUDE,True
The mutational load and a T-cell inflamed tumor phenotype identify ovarian cancer patients rendering tumor-reactive T cells from PD-1+ tumor-infiltrating lymphocytes,DOI_a7ec119d7cf2,EXCLUDE,True
"Патоморфология лимфатических узлов в случаях тяжелой инфекции, вызванной SARS-Cov-2, наблюдавшихся в Приморском крае",DOI_8784f4714429,EXCLUDE,True
B7-CD28 interaction is a late acting co-stimulatory signal for human T cell responses,PMID_9263006,EXCLUDE,True
Consensus DNA and amino acids sequences of the recombinant panfilovirus glycoprotein specific mAb 4B3B5 and its expression in CHO mammalian cell lines,DOI_3641ff8dcf36,EXCLUDE,True
"Inpatient Generalist Palliative Care During the SARS-CoV-2 Pandemic – Experiences, Challenges and Potential Solutions",DOI_5af42689fd7e,EXCLUDE,True
Involvement of Bradykinin and Folate receptor in calming the SARS-COV2 cytokine storm: Lessons learnt from lung cancer,DOI_ed900abee9ce,EXCLUDE,True
Safety and Immunogenicity of an In Vivo Muscle Electroporation Delivery System for DNA-hsp65 Tuberculosis Vaccine in Cynomolgus Monkeys,PMID_38140266,EXCLUDE,True
Cationic Lipid-Based Formulations for Encapsulation and Delivery of Anti-EFG1 2’OMethylRNA Oligomer,DOI_cacb93f24718,EXCLUDE,True
New Epidermal-Growth-Factor-Related Insights Into the Pathogenesis of Multiple Sclerosis: Is It Also Epistemology?,PMID_34899572,EXCLUDE,True
Efficacy of microbicidal actives and formulations for inactivation of Lassa virus in suspension,PMID_37563252,EXCLUDE,True
Non-specific anti-viral approach towards Ebola virus infection: a comment on “Against Ebola: type I interferon guard risk and mesenchymal stromal cell combat sepsis”,PMID_25743126,EXCLUDE,True
Rescue of MHC-1 Antigen Processing Machinery by Down-Regulation in Expression of IGF-1 in Human Glioblastoma Cells,PMID_23526983,EXCLUDE,True
Antiviral activity of Ugandan medicinal plants against human immunodeficiency virus type-1 (HIV-1),DOI_f4689ae627ef,EXCLUDE,True
Kongreß für Laboratoriumsmedizin 1998,DOI_9c2d86b0d82a,EXCLUDE,True
RNA Interference,DOI_65ef5a4add9c,EXCLUDE,True
Up-regulation of RIP1 and IPS-1 in chronic HBV infected patients,PMID_31429854,EXCLUDE,True
"Geometrie und Funktion der Hundenase: Wie ändert sich die Funktion, wenn die Form verändert wird?",PMID_20632242,EXCLUDE,True
Isolating patients in hospital to control infection. Part IV. Nursing procedures.,PMID_359100,EXCLUDE,True
Health Care Risk Waste Generated in Domestic Settings through Home Health: A Review of the Health and Environmental Impact in South Africa,DOI_40591c2a8811,EXCLUDE,True
The tumor stroma influences immune cell distribution and recruitment in a PDAC-on-a-chip model,PMID_37205118,EXCLUDE,True
"Community Normal Reference Values for CD3+, CD4+, CD8+T Lymphocytes and Leucocytes among Immunocompetent Adults in Coastal Kenya",DOI_2c59e5704d54,EXCLUDE,True
Mononuclear and Tetranuclear Copper(II) Complexes Bearing Amino Acid Schiff Base Ligands: Structural Characterization and Catalytic Applications,PMID_34885882,EXCLUDE,True
Contemporary preclinical mouse models for pediatric rhabdomyosarcoma: from bedside to bench to bedside,PMID_38371622,EXCLUDE,True
Intravenous Administration of Ad26.COV2.S Does Not Induce Thrombocytopenia or Thrombotic Events or Affect SARS-CoV-2 Spike Protein Bioavailability in Blood Compared with Intramuscular Vaccination in Rabbits,PMID_38140195,EXCLUDE,True
"Preliminary Assessment of Safety and Immunogenicity of an Inactivated Whole-Virion Vaccine against Influenza А (H1N1) Pdm09 Containing Aluminum Hydroxide Adjuvant: A Randomized, Blinded Phase I Clinical Study",DOI_675d848daf38,EXCLUDE,True
Comprehensive Performance Assessment of Multi-Neural Ensemble Model for Mortality Prediction in ICU,DOI_99cb925d0be3,EXCLUDE,True
Why and how should we simulate platform trials? Learnings from EU-PEARL,PMID_39819305,EXCLUDE,True
Obtaining Recombinant Antigens for the Development of Serological Diagnosis of Marburg Fever,DOI_50c13be57141,EXCLUDE,True
Marburg Virus Structure Revealed in Detail,PMID_22110402,EXCLUDE,True
Chemical and biological weapons a real threat in the armed conflict of Russia and Ukraine.,DOI_b6437e916f5d,EXCLUDE,True
Cardiomyopathies and Congenital Heart Disease in Pregnancy,PMID_30655649,EXCLUDE,True
Assessing Community Health Workers Compliance to who Best Practices for Safe Injection of Contraceptive in a Rural Community Setting of Tanzania,DOI_d49555283c9d,EXCLUDE,True
Bacteriophage M13 May Be Used for the Assessment of Viral Transfer during Doffing of Ebola-Level Personal Protective Equipment,PMID_29655392,EXCLUDE,True
Molecular basis for negative-strand RNA virus entry and neutralization by antibodies,PMID_29593155,EXCLUDE,True
Egy-Score Predicts Severe Hepatic Fibrosis and Cirrhosis in Egyptians With Chronic Liver Diseases: A Pilot Study,PMID_24046790,EXCLUDE,True
Best Efforts in the Taxonomy of Obligation – The Case of the EU Vaccine Contracts,DOI_194a512246e8,EXCLUDE,True
Possible zoonotic viral threats associated with bats in southern Ukraine,DOI_c84f6bc4e775,EXCLUDE,True
Automated production of specific T cells for treatment of refractory viral infections after allogeneic stem cell transplantation,PMID_36794500,EXCLUDE,True
Conference Report: LPMHealthcare Emerging Viruses 2023 (EVOX23): Pandemics—Learning from the Past and Present to Prepare for the Future,PMID_39204279,EXCLUDE,True
Viruses exploit growth factor mechanisms to achieve augmented pathogenicity and promote tumorigenesis,PMID_38526562,EXCLUDE,True
Funktionale Analyse des CC-Typ Glutaredoxin ROXY19 in Arabidopsis thaliana,DOI_74f42b40d38f,EXCLUDE,True
Reduction in peripheral blood K cells and activated T cells in primary biliary cirrhosis.,PMID_304826,EXCLUDE,True
Engels@200: Friedrich Engels and Digital Capitalism. How Relevant Are Engels’s Works 200 Years After His Birth?,DOI_324f945bc666,EXCLUDE,True
Electron-Beam-Lithographed Nanostructures as Reference Materials for Label-Free Scattered-Light Biosensing of Single Filoviruses,PMID_29789514,EXCLUDE,True
Die Bedeutung fachlich-wissenschaftlicher Grundprinzipien und die Folgen ihrer Missachtung,DOI_8bebf39ab9e3,EXCLUDE,True
Lymphocyte subsets in the peripheral blood are disturbed in systemic sclerosis patients and can be changed by immunosuppressive medication,PMID_34694439,EXCLUDE,True
"International code of nomenclature of bacteria and viruses; bacteriological code, publication date: June, 1958",DOI_81bfcda873bf,EXCLUDE,True
CAML Does Not Modulate Tetherin-Mediated Restriction of HIV-1 Particle Release,PMID_20126395,EXCLUDE,True
Notwendigkeit einer digitalen Transformation des Rechtsunterrichts – Virtual Enhanced Inverted Classroom (VEIC) und Constructive Alignment 4.0 als Lehren aus der COVID-19 Pandemie,DOI_c1e436f00a7f,EXCLUDE,True
Efficacy and Safety of Prothrombin Complex Concentrates in Liver Transplantation: Evidence from Observational Studies,PMID_37297943,EXCLUDE,True
An analysis of women victims of sexual violence in one area in Republic of Korea,DOI_f86c55b81a58,EXCLUDE,True
Molecular Targets of the 5-Amido-Carboxamide Bumped Kinase Inhibitor BKI-1748 in Cryptosporidium parvum and HCT-8 Host Cells,PMID_38473953,EXCLUDE,True
"Cryofibrinogen—Characteristics and Association with Cryoglobulin: A Retrospective Study Out of a Series of 1,712 Samples over 7 Years",PMID_37072111,EXCLUDE,True
Processus de veille documentaire scientifique au profit de la veille sanitaire de défense,DOI_efdd1da6dbeb,EXCLUDE,True
Incidence of Anti HIV Antibodies and Viral Antigen in Standard and Control sera,PMID_3480327,EXCLUDE,True
TLR9 and NF-κB Are Partially Involved in Activation of Human Neutrophils by Helicobacter pylori and Its Purified DNA,PMID_24987851,EXCLUDE,True
Vergleich verschiedener Methoden zum serologischen Nachweis von α1-Foetoprotein im Serum,DOI_cbdf334efe96,EXCLUDE,True
Aminotransferasas séricas en pacientes con Dengue tipo 3,DOI_ae358f12ce2d,EXCLUDE,True
Decoding Functional High-Density Lipoprotein Particle Surfaceome Interactions,PMID_36012766,EXCLUDE,True
"Rapid, reliable, and cheap point-of-care bulk testing for SARS-CoV-2 by combining hybridization capture with improved colorimetric LAMP (Cap-iLAMP)",DOI_2e38a824cbbc,EXCLUDE,True
Recall of Prior Knowledge in Medical Microbiology Among Medical Interns: A Multicenter Cross-Sectional Assessment in Saudi Arabia,PMID_35879993,EXCLUDE,True
Preservation of scRNA-Seq Libraries Using Existing Inactivation Protocols,PMID_38392905,EXCLUDE,True
Specific and non-specific serological markers in the screening for congenital CMV infection,PMID_2850935,EXCLUDE,True
Pediatric nephrotic syndrome: The interplay of oxidative stress and inflammation,PMID_39139165,EXCLUDE,True
Could recurrent otitis media predict primary antibody deficiencies in Egyptian children?,DOI_9e7546325b70,EXCLUDE,True
Quantification of antigen‐reactive T cells by a modified ELISPOT assay based on freshly isolated blood dendritic cells,PMID_11835528,EXCLUDE,True
Hematological and Serum Biochemical Analyses in Experimental Caprine Besnoitiosis,PMID_21738268,EXCLUDE,True
Understated or overrated? Reflections on science advice for policy in times of crises,DOI_55e367f3ad28,EXCLUDE,True
"Ébola: caracterización, historia y manifestaciones cutáneas; lo que debemos saber",PMID_26757869,EXCLUDE,True
The Use of Shells of Marine Molluscs in Spanish Ethnomedicine: A Historical Approach and Present and Future Perspectives,PMID_37895974,EXCLUDE,True
Anti-EU and Anti-LGBT Attitudes in Poland: Considering Quantitative and Qualitative Evidence,DOI_067c2188c4b5,EXCLUDE,True
ECOLOGO-HYGIENIC PRECONDITIONS AND ENGINEERING APPROACHES TO MEDICAL WASTE MANAGEMENT,DOI_1bcd27974d19,EXCLUDE,True
"Novel application of capture-recapture methods to estimate the completeness of contact tracing during a large outbreak of Ebola Virus Disease, Democratic Republic of Congo, 2018-2020",DOI_2620153754e7,EXCLUDE,True
Mapping of the regions involved in self-interaction of rice stripe virus P3 protein,PMID_26982473,EXCLUDE,True
MicroRNA-499 rs3746444 polymorphism in Egyptian children with biliary atresia,PMID_33145433,EXCLUDE,True
Acute Hemodynamic Effects of Nebulized Iloprost via the I‐Neb Adaptive Aerosol Delivery System in Pulmonary Hypertension,PMID_25992279,EXCLUDE,True
"Childhood Trauma in Patients With PAH—Prevalence, Impact on QoL, and Mental Health—A Preliminary Report",PMID_35222119,EXCLUDE,True
"Effects of Fermented Red Ginseng Supplementation on Growth Performance, Apparent Nutrient Digestibility, Blood Hematology and Meat Quality in Finishing Pigs",DOI_25d321bc4d10,EXCLUDE,True
Biosecurity implications of the synthesis of pathogenic viruses,PMID_16859374,EXCLUDE,True
Learning from the microbes: exploiting the microbiome to enforce T cell immunotherapy,PMID_37799719,EXCLUDE,True
Codon usage bias analysis of the gene encoding NAD+-dependent DNA ligase protein of invertebrate iridescent virus 6,DOI_c8834e50f3b0,EXCLUDE,True
Anticardiac Antibodies in Patients with Chronic Pericardial Effusion,PMID_26941472,EXCLUDE,True
"Effects on pig immunophysiology, PBMC proteome and brain neurotransmitters caused by group mixing stress and human-animal relationship",PMID_28475627,EXCLUDE,True
Entwicklung und Fortschritte des Nationalen Obduktionsnetzwerks (NATON),PMID_38427066,EXCLUDE,True
TNF‑α and soluble forms of TNF receptors 1 and 2 in the serum of patients with Crohn’s disease and ulcerative colitis,PMID_23160117,EXCLUDE,True
A Minimum of Three Motifs Is Essential for Optimal Binding of Pseudomurein Cell Wall-Binding Domain of Methanothermobacter thermautotrophicus,PMID_21738718,EXCLUDE,True
"Assessment of Emergence, Economic Losses and Prevention of Zoonotic Infections",DOI_8559b893b633,EXCLUDE,True
Brachyzephalie bei Hund und Katze: eine „menschengemachte” Obstruktion der oberen Atemwege,PMID_20632241,EXCLUDE,True
"Sequencing, cloning and expression of the panfilovirus glycoprotein specific recombinant mAb 8C12F11 in a CHO mammalian cell line",DOI_5b508c3871c2,EXCLUDE,True
Rubella Virus- and Cytomegalovirus-Associated Anterior Uveitis: Clinical Findings and How They Relate to the Current Fuchs Uveitis Syndrome Classification,PMID_38983570,EXCLUDE,True
COVID-19: Myth and Reality,DOI_b69d03b5a43b,EXCLUDE,True
Unquantifiably low aldosterone concentrations are prevalent in hospitalised COVID-19 patients but may not be revealed by chemiluminescent immunoassay,DOI_74b993f65584,EXCLUDE,True
EMERGING INFECTIOUS DISEASES - A PERSPECTIVE,DOI_07443065ef9f,EXCLUDE,True
A Comprehensive Investigation of Glycoprotein-based Nucleic Acid Vaccines for Hantaan Virus,DOI_e3a3baac334a,EXCLUDE,True
Optimized SEIR Model for Predicting and Controlling Diphtheria Outbreaks in Nigeria,DOI_9df90b244dd0,EXCLUDE,True
Experimental countermeasures against Ebola virus: current progress and an ethical conundrum,PMID_25139506,EXCLUDE,True
Relationships between the Level of Alcohol Consumption and Abnormality in Biomarkers According to Facial Flushing in Korean Male Drinkers,PMID_23560211,EXCLUDE,True
Biocompatible Anionic Polymeric Microspheres as Priming Delivery System for Effetive HIV/AIDS Tat-Based Vaccines,PMID_25356594,EXCLUDE,True
Circulating microRNAs and hepcidin as predictors of iron homeostasis and anemia among school children: a biochemical and cross-sectional survey analysis,PMID_38102707,EXCLUDE,True
"Suppression of Metastatic Ovarian Cancer Cells by Bepridil, a Calcium Channel Blocker",PMID_37511982,EXCLUDE,True
Occasional essay: Multiple sclerosis in the digital age: ‘seeing through a glass darkly’,PMID_32709701,EXCLUDE,True
Uso de los simuladores en odontología pospandemia,DOI_cd08c9f3c44a,EXCLUDE,True
Quantitation of Oxidative Modifications of Commercial Human Albumin for Clinical Use,PMID_26725709,EXCLUDE,True
Estimating coronavirus disease 2019 (COVID-19)–caused deaths in hospitals and healthcare units: Do hospital-acquired infections play a role? Comments with a proposal,PMID_33736720,EXCLUDE,True
"Urinary biomarkers of early renal injury in antiretroviral‐naïve HIV‐positive persons in Shanghai, China: comparison with the general population",DOI_cef922521861,EXCLUDE,True
Global Green Value Chains: Greening China’s “Soft Commodity” Value Chains,DOI_ee5bcd508c81,EXCLUDE,True
DEVELOPMENT OF VACCINES BASED ON ADENOVIRAL VECTORS: A REVIEW OF FOREIGN CLINICAL STUDIES (PART 2),DOI_0ab63117c6ec,EXCLUDE,True
Lentiviral Infection of Rhesus Macaques Causes Long-Term Injury to Cortical and Hippocampal Projections of Prostaglandin-Expressing Cholinergic Basal Forebrain Neurons,PMID_22157616,EXCLUDE,True
Putative Association of ITGB1 Haplotype with the Clearance of HBV Infection,DOI_a8fbf6e2c028,EXCLUDE,True
"Improving the pharmacokinetics, biodistribution and plasma stability of monobodies",PMID_38617793,EXCLUDE,True
Descoberta e caracterização de vírus emergentes e reergentes em áreas peri-florestais.,DOI_736102e5c3ca,EXCLUDE,True
Emerging Viruses Besides the Severe Acute Respiratory Syndrome Coronavirus 2 (SARS-CoV-2),DOI_201b91a70a81,EXCLUDE,True
Subjective Well-Being in Healthcare Professionals in Colombia: On the Constitution of Subjectivity and the Ethics of Care in Times of the COVID-19 Pandemic,PMID_34867683,EXCLUDE,True
A Critical Evaluation of the National Health System of Uganda,DOI_619f0fd74835,EXCLUDE,True
Vigilância em Saúde: Interfaces entre a Saúde Pública e a Pesquisa Científica,DOI_123912fb9853,EXCLUDE,True
Durchflußzytometrische Charakterisierung leukämischer Blutproben mit einer Acridinorange-Schnellfärbung,DOI_d3cf48825e23,EXCLUDE,True
Monkey Pox: An Emerging Outbreak,DOI_d5d465bae888,EXCLUDE,True
Comparative Cell Surface Proteomic Analysis of the Primary Human T Cell and Monocyte Responses to Type I Interferon,PMID_33628210,EXCLUDE,True
Prematurity and maternal bronchial hyperresponsiveness,PMID_2810000,EXCLUDE,True
Autoimmune reactivity of IgM acquired after oxidation,PMID_22195993,EXCLUDE,True
Tick findings from subterranean environments in the Central German Uplands and Luxembourg reveal a predominance of male Ixodes hexagonus,PMID_37115465,EXCLUDE,True
Changes in the mannan binding lectin (MBL) concentration in human milk during lactation,PMID_12424804,EXCLUDE,True
Aspergillus fumigatus in sputum during acute EBV infection,PMID_10438310,EXCLUDE,True
Natural products: Designing Russian medications,PMID_32288428,EXCLUDE,True
An Antiviral Drug Screening Platform with a FRET Biosensor for Measurement of Arenavirus Z Assembly,PMID_33191384,EXCLUDE,True
La « menace sauvage »,DOI_e0cbfba3a5e1,EXCLUDE,True
RESULTS OF Fc-PROTEIN FUSION TECHNOLOGY APPLICATION FOR VACCINE DESIGN AGAINST INFECTIOUS DISEASES OF ANIMALS AND HUMAN,DOI_d14207f78eb7,EXCLUDE,True
Reflections on the Virulence of Infections,DOI_5a34afb751ae,EXCLUDE,True
Severe cerebral involvement due to idiopathic systemic capillary leak syndrome,PMID_27099745,EXCLUDE,True
Differential Responses of Commercial Tomato Rootstocks to Branched Broomrape,DOI_86e3386cbe8c,EXCLUDE,True
"Conversion Factors to Compare Serum Concentrations of Anti-HBs, Anti-SARS-CoV-2 and Anti-Tetanus Toxin IgG",PMID_40843681,EXCLUDE,True
"Drug Repurposing Investigation for Combating Ebola Virus Disease: Database Mining, Docking Calculations, Molecular Dynamics, and Density Functional Theory Study",PMID_40891583,EXCLUDE,True
"Safety and immunogenicity of a varicella vaccine without human serum albumin (HSA) versus a HSA-containing formulation administered in the second year of life: a phase III, double-blind, randomized study",DOI_26ea0e09aafc,EXCLUDE,True
"Hunting for fortune. Wild animals, goddesses and the play of perspectives in early Tibetan dice divination",DOI_a220119d93a0,EXCLUDE,True
"Editorial: Evolution, pathogenesis, host interactions and therapeutic strategies against monkeypox virus",PMID_37900315,EXCLUDE,True
COVID-19 Cardiac Complication- Myocarditis,DOI_20a331a5b2a7,EXCLUDE,True
RICKETTSIA TSUTSUGAMUSHI ANTIBODY IN MOTHER/CORD PAIRS OF SERA,PMID_6790744,EXCLUDE,True
HoTResDB: host transcriptional response database for viral hemorrhagic fevers,PMID_29028885,EXCLUDE,True
"""Class Struggle"": Marxism against Postmodernism in Educational Theory",DOI_39726b13427d,EXCLUDE,True
Global Literary Studies,DOI_91967638e955,EXCLUDE,True
Clearance of CD43-Capped Cells by Macrophages: Capping Alone Leads to Phagocytosis,PMID_22466560,EXCLUDE,True
Detection of Antibody to a New Antigen Induced by Epstein-Barr Virus in Rheumatoid Arthritis,PMID_216133,EXCLUDE,True
Achievements of Virus Research,DOI_d7a97bd44ed7,EXCLUDE,True
DOCLASP - Docking ligands to target proteins using spatial and electrostatic congruence extracted from a known holoenzyme and applying simple geometrical transformations,DOI_b8f7f0b7ca57,EXCLUDE,True
The examination of tracheal wash fluid and brochoalveolar lavage fluid obtains important information regarding type and severity of lung diseases,DOI_db025c8aa816,EXCLUDE,True
Épidémies: Leçons d’Histoire,PMID_32530418,EXCLUDE,True
Synthesis and Properties of (+)-Ketopinic and (–)-Camphanic Acids Esters Bearing a Nitrogen-Containing Heterocycle,DOI_422cee9cd983,EXCLUDE,True
Ebola Virus Disease Outbreaks – A Systematic Review,DOI_f870b8a4340a,EXCLUDE,True
Zoonotic Spillover and their Relativity to Pandemics: Review Article,DOI_2b24a38e5cb0,EXCLUDE,True
Liposome-Encapsulated Adjuvants are Potent Inducers of Antigen-Specific T-Cells in Vivo,DOI_1df6fed14f2b,EXCLUDE,True
"From Chimps to Bats: Human Social Evolution and Pandemic Potential over 15,000 Years",DOI_b7dbe46be3b5,EXCLUDE,True
Dwarf bat’s &lt;i&gt;(Pipistrellus pipistrellus)&lt;/i&gt; lung diploid cell strains and their permissivity to orbiviruses &lt;i&gt;(Reoviridae: Orbivirus)&lt;/i&gt; – pathogens of vector-borne animal diseases,PMID_35831965,EXCLUDE,True
Role of vector in transmission of viral hemorrhagic fever,DOI_bb6e253afd0c,EXCLUDE,True
İklim Değişikliğinin Yarasalar Üzerine Olası Etkileri,DOI_cc4a07f2f830,EXCLUDE,True
Lessons that can be learned from the SARS-CoV-2 pandemic and their impact on the prophylaxis and treatment development for neglected tropical arboviruses,DOI_8ee1f0eec3e5,EXCLUDE,True
"Insight into SARS-CoV-2: Epidemiology, Hosts and One Health",DOI_24e14acbf0c9,EXCLUDE,True
Identification of effective natural compounds as HIF-1Alpha mimetics for diabetic wound healing; A systematic in-silico study,DOI_21504c6bea90,EXCLUDE,True
Promotoranalyse und Expressionsstudien der murinen und humanen fork head homologen Gene Foxq1 und FOXQ1,DOI_45154f18a2a4,EXCLUDE,True
Hepatic involvement of infectious origin not related to hepatotropic virus,DOI_64ec987d4f4f,EXCLUDE,True
Achievements in virus research,DOI_32fdbf9a9777,EXCLUDE,True
Clinical and imaging features of lymphomatosis cerebri: analysis of 8 cases and systematic review of the literature,PMID_37979126,EXCLUDE,True
National primate plan /,DOI_f292a85793e9,EXCLUDE,True
9e Congrès international francophone « Transitions épidémiologiques en Afrique : quelles réponses des systèmes de santé ? » — Résumés des communications orales,PMID_24243214,EXCLUDE,True
Heroes and Villains in Memes on the 2022 Russian Invasion of Ukraine,DOI_e4cfa68fe442,EXCLUDE,True
Surveillance of emerging infectious diseases in wild non-human primates in Kenya: Successes and challenges,DOI_f313347b71d3,EXCLUDE,True
Viro3D: a comprehensive database of virus protein structure predictions,PMID_40958060,EXCLUDE,True
A Review of Anti-Inflammatory Drugs Use in the Treatment of People Infected by Coronavirus Disease 2019 (COVID-19),DOI_6c822a7a347f,EXCLUDE,True
Evaluation of Patient Follow-up with Transient Hypogammaglobulinemia in Infancy Diagnosis,DOI_8d4343a178b5,EXCLUDE,True
Biodiversity and seasonal distribution of ticks in southeastern Serbia,DOI_3eb01637ea56,EXCLUDE,True
Diagnostic Validity of Multivariate Combinations of Biochemical Analytes as Markers for Rejection and Infection in the Follow-Up of Patients with Heart Transplants,PMID_2466945,EXCLUDE,True
"A new species of &lt;i&gt;Phthiridium&lt;/i&gt; (Diptera: Nycteribiidae) from Iriomote Island, the Ryukyu Islands, Japan, with a key to nycteribiid bat flies of Japan",DOI_157bbbba78ba,EXCLUDE,True
Understanding the 2013-2015 Ebola Outbreak,DOI_856c5f88cd10,EXCLUDE,True
Caffeine levels following treatment of obstructive sleep apnoea,PMID_12947143,EXCLUDE,True
In Vitro Effects of 5-Lipoxygenase Pathway Inhibition on Rhinovirus-Associated Bronchial Epithelial Inflammation,PMID_33847974,EXCLUDE,True
A multifactorial approach to understanding andropause,DOI_97ac36ec8040,EXCLUDE,True
Rare and Emerging Viral Infections in the Transplant Population,DOI_36581a3565e4,EXCLUDE,True
Management of an extrasphincteric fistula in an HIV-positive patient by using fibrin glue: a case report with tips and tricks,PMID_20152052,EXCLUDE,True
Kinetische und proteinchemische Untersuchungen am Succinyl-Papain / Kinetic and Chemical Investigations of Succinyl-Papain,DOI_c1a45f821698,EXCLUDE,True
Calcium signaling involved in bovine herpesvirus 1 replication in MDBK cells,PMID_29186967,EXCLUDE,True
Дизайн искусственных полиэпитопных Т-клеточных иммуногенов для создания профилактических и терапевтических вакцин,DOI_27a19b5c2c48,EXCLUDE,True
Detection of hepatitis B virus pre-S1 and pre-S2 determinants in paraffin wax embedded liver tissue: importance of reagents used.,PMID_1856286,EXCLUDE,True
Vesicular stomatitis virus-based vaccine targeting plasmodium blood-stage antigens elicits immune response and protects against malaria with protein booster strategy,PMID_36504817,EXCLUDE,True
Inhibition of Human Cathepsins B and L by Caffeic Acid and Its Derivatives,PMID_33383850,EXCLUDE,True
A Rac1-FMNL2 signaling module affects cell-cell contact formation independent of Cdc42 and membrane protrusions,PMID_29579104,EXCLUDE,True
Milk-derived exosomes carrying siRNA-KEAP1 promote diabetic wound healing by improving oxidative stress,DOI_9b960e41b339,EXCLUDE,True
A clinical profile of geriatric patients at a chiropractic teaching clinic in KwaZulu-Natal,DOI_53a1e2cda390,EXCLUDE,True
Molecular Pharmacology and Pathology of Strokes,DOI_7634509aae08,EXCLUDE,True
Upper airway resistance: species-related differences,PMID_20632240,EXCLUDE,True
Spondias mombin: biosafety and GC–MS analysis of anti-viral compounds from crude leaf extracts,DOI_e9acd9288ce6,EXCLUDE,True
